{"schema_version":"foigent.integration-campaign-manifest.v1","canonicalization":"foigent.integration-control.canonical-json.v1","profile":"poc_source_evidence","decision_id":"fixture-decision-20260811","decision_sha256":"","campaign_id":"fixture-campaign-20260811","frozen_at":"2029-12-31T23:00:00Z","requested_actions":["poc_traffic","unirouter_source_evidence_capture","xinsight_source_evidence_import"],"requested_window":{"not_before":"2030-01-01T00:00:00Z","not_after":"2030-01-02T00:00:00Z"},"explicit_exclusions":["bootstrap","credential_mutation","data_reset","deployment","production","target_trust_mutation","traffic_outside_frozen_request_set","worker_activation"],"source_binding":{"schema_version":"unirouter.source-evidence.source-scope.v1","sha256":""},"request_set":{"schema_version":"unirouter.source-evidence.request-set.v1","sha256":"","max_requests":20,"max_facts":200},"components":[{"product":"unirouter","role":"source_evidence_producer","contract":{"id":"unirouter.source-evidence.component-package.v1","sha256":""},"release":{"schema_version":"unirouter.release-state-identity.v1","sha256":""},"scope_receipt":{"schema_version":"unirouter.source-evidence-scope-receipt.v1","sha256":""}},{"product":"xinsight","role":"source_evidence_consumer","contract":{"id":"xinsight.signed-campaign-package-consumer.v1","sha256":""},"release":{"schema_version":"xinsight.release-identity.v1","sha256":""},"scope_receipt":{"schema_version":"xinsight.source-evidence-import-scope-receipt.v1","sha256":""}}],"source_evidence_signing":{"purpose":"source_evidence","domain":"unirouter.source-evidence.component.v1","signing_key_ref":"source-evidence-fixture-01","signer_public_key_id":"ed25519:sha256:7bb96b8b64efbaade610d2f567d51fde1828209b51bd796e869eaad3d7960d38","trust_set_sha256":"","claim_scope":"unirouter.poc-source-facts.v1","package_scope_state":"complete","nested_execution_evidence_v2":"partial","runtime_close_marker_available":false},"authorization_signing":{"purpose":"integration_campaign_authorization","domain":"foigent.integration-campaign-authorization.v1","trust_set_sha256":""}}
